task,user_action_and_explanation,observation
"What is 10,000 US dollars worth now in 1980 and in 1970?",Going to https://www.wolframalpha.com/,Went to https://www.wolframalpha.com/
"What is 10,000 US dollars worth now in 1980 and in 1970?","type ""10000 USD to 1980 USD and 1970 USD"" into the input box with placeholder 'Enter what you want to calculate or know about' to find out the equivalent value in 1980 and 1970.","The query input ""10000 USD to 1980 USD and 1970 USD"" did not return meaningful results. It seems Wolfram Alpha interpreted your query incorrectly. You should try rephrasing the query or specifying conversion separately for each decade. For instance, ""CPI-adjusted value of 10000 USD from 2023 to 1980"" and ""CPI-adjusted value of 10000 USD from 2023 to 1970"" might yield the desired information."
"What is 10,000 US dollars worth now in 1980 and in 1970?","type ""CPI-adjusted value of 10000 USD from 2023 to 1980"" into the input box with placeholder 'Enter what you want to calculate or know about' to find out the equivalent value specifically for 1980.","The query ""CPI-adjusted value of 10000 USD from 2023 to 1980"" has been entered into Wolfram Alpha. The site correctly interpreted the input, showing that it is calculating the 2023 US dollars value in 1980. However, the actual dollar amount for the 1980 equivalent is not displayed in the visible part of the screenshot. Scroll down or check for additional results to find the detailed output."
"What is 10,000 US dollars worth now in 1980 and in 1970?","scroll down to find the detailed result for the CPI-adjusted value of 10000 USD from 2023 to 1980, as the visible part does not show the output value.","The equivalent value of $10,000 from 2023 in 1980 dollars is $2,754.57, as calculated by Wolfram Alpha. This information is based on the Consumer Price Index with an average rate of inflation of 3.04% per year. You can now proceed to perform a similar calculation for the year 1970 to complete the task."
"What is 10,000 US dollars worth now in 1980 and in 1970?","type ""CPI-adjusted value of 10000 USD from 2023 to 1970"" into the input box with placeholder 'Enter what you want to calculate or know about' to find out the equivalent value for 1970.","The equivalent value of $10,000 from 2023 in 1970 dollars is $1,297.76, as calculated by Wolfram Alpha. This completes the task, giving you both the 1980 and 1970 equivalent values based on the Consumer Price Index."
"What is 10,000 US dollars worth now in 1980 and in 1970?",Summarizing last observations,"The most recent observations show that the equivalent value of $10,000 from 2023 in 1970 dollars is $1,297.76, calculated by Wolfram Alpha using the Consumer Price Index with an average inflation rate of 3.93% per year. This completes the task of determining the 1980 and 1970 equivalent values, with the 1980 value previously determined as $2,754.57. For full context and details, refer to the complete task history."