task,user_action,observation
"Look up the definition of \""cryptocurrency\"" on Cambridge Dictionary, provide the pronunciation, and use it in two example sentences that illustrate different contexts.",Going to https://dictionary.cambridge.org/,Went to https://dictionary.cambridge.org/
"Look up the definition of \""cryptocurrency\"" on Cambridge Dictionary, provide the pronunciation, and use it in two example sentences that illustrate different contexts.","type ""cryptocurrency"" into the search bar with the placeholder ""Search English—Chinese (Traditional)"" and press Enter to find the definition and pronunciation.","The definition of ""cryptocurrency"" from the Cambridge Dictionary is visible. It is described as ""a digital currency produced by a public network, rather than any government, that uses cryptography to make sure payments are sent and received safely."" 

The pronunciation is available in both UK: /ˈkrɪp.təʊˌkʌr.ən.si/ and US: /ˈkrɪp.təˌkɝː.ən.si/.

Example sentences:
1. ""After much research, she decided to invest in a cryptocurrency to diversify her portfolio.""
2. ""The company developed a new platform to facilitate cryptocurrency transactions securely."""
"Look up the definition of \""cryptocurrency\"" on Cambridge Dictionary, provide the pronunciation, and use it in two example sentences that illustrate different contexts.",Summarizing last observations,"The most recent observations confirm that the definition of ""cryptocurrency"" was obtained from the Cambridge Dictionary, which describes it as ""a digital currency produced by a public network, rather than any government, that uses cryptography to make sure payments are sent and received safely."" The pronunciation is provided for both UK (/ˈkrɪp.təʊˌkʌr.ən.si/) and US (/ˈkrɪp.təˌkɝː.ən.si/). Example sentences include: ""After much research, she decided to invest in a cryptocurrency to diversify her portfolio,"" and ""The company developed a new platform to facilitate cryptocurrency transactions securely."" Additional context from the screenshots shows translations in Chinese, Spanish, and Portuguese, and examples from Wikipedia explaining cryptocurrency's use and market position. This summary reflects only the latest observations; refer to the complete task history for full details."