task,user_action_and_explanation,observation
Search for 'Data Analysis' courses on Coursera. Apply filters to find courses that are 'Beginner Level' and have a duration ranging from 1 to 3 months. Determine the total count of courses that match these specifications.,Going to https://www.coursera.org/,Went to https://www.coursera.org/
Search for 'Data Analysis' courses on Coursera. Apply filters to find courses that are 'Beginner Level' and have a duration ranging from 1 to 3 months. Determine the total count of courses that match these specifications.,click on the search icon at the top-right corner to start a search for 'Data Analysis' courses.,"The search icon was successfully clicked, and the search bar is now open. You can enter 'Data Analysis' into the search field to proceed with finding relevant courses. The page also shows popular specializations and search topics, but you need to type your specific keyword to continue with your task."
Search for 'Data Analysis' courses on Coursera. Apply filters to find courses that are 'Beginner Level' and have a duration ranging from 1 to 3 months. Determine the total count of courses that match these specifications.,type 'Data Analysis' into the search bar with the placeholder 'What do you want to learn?' to find relevant courses.,"The search results for 'Data Analysis' have been displayed. The courses shown include details such as ratings, duration, and level. One course, 'Excel Basics for Data Analysis,' is marked as 'Beginner' and has a duration of '1-3 months.' To continue, you need to apply filters specifically for 'Beginner Level' courses with a duration between '1 to 3 months' to narrow down the search further. After applying these filters, count the courses that meet these criteria."
Search for 'Data Analysis' courses on Coursera. Apply filters to find courses that are 'Beginner Level' and have a duration ranging from 1 to 3 months. Determine the total count of courses that match these specifications.,click on the 'All Filters' button or link to open the filter menu. This is needed to apply 'Beginner Level' and '1-3 months' duration filters to narrow down the search results as per the task requirements.,"The filter menu is open, displaying various filter categories such as Subject, Language, Level, Duration, and more. To proceed, you need to expand the 'Level' and 'Duration' sections. Then, select 'Beginner' under Level and '1-3 months' under Duration. Once these filters are applied, you will be able to see the filtered list of courses. After applying the filters, count the total number of courses that match these criteria."
Search for 'Data Analysis' courses on Coursera. Apply filters to find courses that are 'Beginner Level' and have a duration ranging from 1 to 3 months. Determine the total count of courses that match these specifications.,click on the 'Level' section to expand it. This is necessary to select the 'Beginner' filter for the courses.,"The 'Level' section is expanded, showing various options such as 'Beginner', 'Intermediate', 'Advanced', and 'Mixed'. You need to select the 'Beginner' checkbox to filter for beginner-level courses. After this, you'll need to expand and select the '1-3 months' option under the 'Duration' category to complete the filtering process. Once both filters are applied, check the results list for the total count of courses meeting these specifications."
Search for 'Data Analysis' courses on Coursera. Apply filters to find courses that are 'Beginner Level' and have a duration ranging from 1 to 3 months. Determine the total count of courses that match these specifications.,"click on the 'Beginner' checkbox under the 'Level' section to filter courses for beginner-level, then expand the 'Duration' section next to select '1-3 months' and apply both filters.","The 'Beginner' checkbox under the 'Level' section is selected. The next step is to expand the 'Duration' section and select '1-3 months'. After applying these filters, click 'Apply' to view the filtered courses. Ensure to check the total count of courses that match the criteria once both filters are set."
Search for 'Data Analysis' courses on Coursera. Apply filters to find courses that are 'Beginner Level' and have a duration ranging from 1 to 3 months. Determine the total count of courses that match these specifications.,"click on the 'Duration' section to expand it, then select the '1-3 months' checkbox to apply the duration filter.","The 'Duration' section is expanded and the '1-3 months' checkbox is visible, ready to be selected. Once you select this checkbox, click 'Apply' to apply both the 'Beginner' level and '1-3 months' duration filters. After applying, you will be able to see the updated list of courses filtered by these criteria. Remember to check the total count of courses that match the specifications."
Search for 'Data Analysis' courses on Coursera. Apply filters to find courses that are 'Beginner Level' and have a duration ranging from 1 to 3 months. Determine the total count of courses that match these specifications.,click on the '1-3 Months' checkbox under the 'Duration' section to apply the duration filter for courses. This will finalize the filtering criteria before clicking 'Apply' to see the results.,"The '1-3 Months' checkbox under the 'Duration' section is selected. You need to ensure the 'Beginner' checkbox in the 'Level' section is also selected before clicking 'Apply' at the bottom of the filter menu. Once both filters are applied, you can view the filtered course list and determine the total count of courses that match the criteria."
Search for 'Data Analysis' courses on Coursera. Apply filters to find courses that are 'Beginner Level' and have a duration ranging from 1 to 3 months. Determine the total count of courses that match these specifications.,"click on the '1-3 Months' checkbox under the 'Duration' section to apply the duration filter, then click 'Apply' at the bottom to view filtered courses.","The filters for 'Beginner Level' and '1-3 Months' duration have been applied successfully. The current search results show a total of six courses matching these specifications. Each course details its title, provider, skills gained, rating, and reviews, confirming they're beginner level and fall within the 1 to 3 months duration range."
Search for 'Data Analysis' courses on Coursera. Apply filters to find courses that are 'Beginner Level' and have a duration ranging from 1 to 3 months. Determine the total count of courses that match these specifications.,Summarizing last observations,"The most recent observations, supplemented by the current screenshots, reveal that after applying the 'Beginner Level' and '1-3 Months' duration filters on Coursera, a total of ten courses match the specified criteria. Each course displays detailed information, including the course title, provider, skills gained, ratings, and reviews. This summary reflects only the latest observations, and reviewing the complete task history is recommended for full context and details."