task,user_action_and_explanation,observation
Locate the course 'Modern Art & Ideas' on Coursera offered by The Museum of Modern Art. Find out the percentage (rounded) of 3-star ratings in the reviews and note which star level has the lowest percentage.,Going to https://www.coursera.org/,Went to https://www.coursera.org/
Locate the course 'Modern Art & Ideas' on Coursera offered by The Museum of Modern Art. Find out the percentage (rounded) of 3-star ratings in the reviews and note which star level has the lowest percentage.,click the magnifying glass icon in the top right corner of the page to open the search bar and find the course 'Modern Art & Ideas' offered by The Museum of Modern Art.,The search bar is now open. You can type the course name 'Modern Art & Ideas' to find the desired course.
Locate the course 'Modern Art & Ideas' on Coursera offered by The Museum of Modern Art. Find out the percentage (rounded) of 3-star ratings in the reviews and note which star level has the lowest percentage.,type 'Modern Art & Ideas The Museum of Modern Art' into the search bar with the placeholder text 'What do you want to learn?' to locate the specific course offered by The Museum of Modern Art on Coursera.,"The course 'Modern Art & Ideas' by The Museum of Modern Art is visible in the search results with a rating of 4.8 based on 6.5K reviews. You can click on this course to view detailed reviews, including the percentage of 3-star ratings and to identify the star level with the lowest percentage."
Locate the course 'Modern Art & Ideas' on Coursera offered by The Museum of Modern Art. Find out the percentage (rounded) of 3-star ratings in the reviews and note which star level has the lowest percentage.,"click on the course titled 'Modern Art & Ideas' with a rating of 4.8 and 6.5K reviews, displayed under 'The Museum of Modern Art', to view the detailed reviews, including the percentage of 3-star ratings and to identify the star level with the lowest percentage.","The course page for 'Modern Art & Ideas' by The Museum of Modern Art is loaded, showing general details such as rating, enrollment numbers, and the course structure. However, detailed review information, including percentage breakdown of star ratings, is not visible in the current screenshot. The user needs to scroll down or navigate further to locate the reviews section that contains the details on 3-star ratings and the star level with the lowest percentage."
Locate the course 'Modern Art & Ideas' on Coursera offered by The Museum of Modern Art. Find out the percentage (rounded) of 3-star ratings in the reviews and note which star level has the lowest percentage.,"scroll down to view the reviews section and find the detailed percentage breakdown of star ratings, including the 3-star ratings, to identify which star level has the lowest percentage.","The current screenshot displays basic information about the course ""Modern Art & Ideas"" by The Museum of Modern Art but does not include the reviews section or a breakdown of star ratings. To locate this information, further scrolling or navigating within the course page is required to reach the detailed reviews section where the percentage of 3-star ratings and the lowest star level can be found."
Locate the course 'Modern Art & Ideas' on Coursera offered by The Museum of Modern Art. Find out the percentage (rounded) of 3-star ratings in the reviews and note which star level has the lowest percentage.,"scroll further down the page past the current sections to locate the reviews section, where the detailed percentage breakdown of star ratings for the course 'Modern Art & Ideas' can be found. This section is necessary since the current screenshot shows only course information and registration details without the reviews.","The current screenshot shows the ""Modern Art & Ideas"" course page on Coursera, but it still does not show the reviews section or the breakdown of star ratings. Only course modules and some general course details are visible. The user needs to continue scrolling down to reach the reviews section where detailed star rating percentages, including 3-star ratings, can be found."
Locate the course 'Modern Art & Ideas' on Coursera offered by The Museum of Modern Art. Find out the percentage (rounded) of 3-star ratings in the reviews and note which star level has the lowest percentage.,"scroll further down to continue past the current section, as the reviews breakdown is likely located below the course content and overview sections shown in the screenshot.","The current screenshot still does not display the reviews section or the detailed star rating breakdown needed to identify the percentage of 3-star ratings and the star level with the lowest percentage. The displayed sections include module outlines, instructor information, and recommended related courses, but not the reviews. The user needs to continue scrolling further down the page to reach the reviews section."
Locate the course 'Modern Art & Ideas' on Coursera offered by The Museum of Modern Art. Find out the percentage (rounded) of 3-star ratings in the reviews and note which star level has the lowest percentage.,"scroll further down the course page to locate the reviews section, which is needed to access the detailed percentage breakdown of star ratings, including the 3-star ratings and the lowest percentage star level.","The user successfully located the reviews section of the course ""Modern Art & Ideas"" by The Museum of Modern Art. The screenshot shows that the percentage of 3-star ratings is 2.49%. The star level with the lowest percentage is the 1-star rating, which has 0.56%."
Locate the course 'Modern Art & Ideas' on Coursera offered by The Museum of Modern Art. Find out the percentage (rounded) of 3-star ratings in the reviews and note which star level has the lowest percentage.,Summarizing last observations,"Based on the most recent observations, supplemented by the current screenshots, the course ""Modern Art & Ideas"" by The Museum of Modern Art on Coursera has a detailed star rating breakdown. The percentage of 3-star ratings is approximately 2.49% (rounded to 2%). The star level with the lowest percentage is the 1-star ratings at 0.56%. This summary only reflects the latest findings; for full context and detailed history of the task, please refer to the entire task history."