task,user_action_and_explanation,observation
Browse Coursera for Business and Coursera for Teams and summarise some of their advantages.,Going to https://www.coursera.org/,Went to https://www.coursera.org/
Browse Coursera for Business and Coursera for Teams and summarise some of their advantages.,click the menu icon (☰) at the top left of the page to reveal navigation options and locate 'Coursera for Business' and 'Coursera for Teams' sections to explore their advantages.,"The menu is expanded, and the 'For Businesses' option is visible. Selecting 'For Businesses' will likely lead to more information about Coursera for Business, which could include details about Coursera for Teams as well."
Browse Coursera for Business and Coursera for Teams and summarise some of their advantages.,"Changing URL parameters. The suggested URL leads directly to Coursera's business section, which provides comprehensive information about Coursera for Business, including offerings for teams. This is the most relevant page for understanding the advantages and details of these business-focused solutions offered by Coursera.",Went to https://www.coursera.org/business
Browse Coursera for Business and Coursera for Teams and summarise some of their advantages.,Summarizing last observations,"The most recent observations from the visit to Coursera for Business highlight several advantages of their services, including Coursera for Teams:

1. **Skill Development**: Coursera offers training from industry experts and top universities to enhance team skills in high-demand areas.

2. **Customized Learning**: The platform provides tailored learning paths and AI tools to enrich the learning experience, helping boost employee engagement with globally recognized credentials.

3. **Cost Efficiency**: Teams can experience a reduction in training costs by 24%, which is substantiated by the statistical data on their site.

4. **Improved Retention and Productivity**: Coursera claims a 38% higher retention rate and a 25% increase in employee productivity.

5. **Scalability**: Learning solutions are scalable, allowing efficient customization according to business needs.

6. **Collaborative Partnerships**: Coursera partners with over 4,300 companies, leveraging content from more than 350 leading universities and industry players to transform team skills.

7. **Comprehensive Programs**: Specific academies like Generative AI, Data and Analytics, Marketing, Tech, Leadership, and Finance are available to cater to various job roles and organizational needs.

8. **Business Transformation Support**: Coursera provides world-class content and hands-on learning experiences to bolster business transformation.

For a thorough understanding, refer to the complete task history."