task,user_action_and_explanation,observation
Tell me the names of Trump's kids,Going to https://www.google.com/,Went to https://www.google.com/
Tell me the names of Trump's kids,"Changing URL parameters. To find the names of Trump's kids, you can use a search engine like Google to quickly obtain accurate information. By modifying the Google search URL to include the query 'Trump's kids names', you will be directed to search results that list the names of Donald Trump's children.",Went to https://www.google.com/search?q=Trump%27s+kids+names
Tell me the names of Trump's kids,Summarizing last observations,"The summary reflects the most recent observations:

The search results provided the names of Donald Trump's children: Barron Trump, Ivanka Trump, Donald Trump Jr., Tiffany Trump, and Eric Trump. These names appeared prominently in the search overview and in the sidebar information about Donald Trump on the search results page. 

For full context and more details about the task, please refer to the complete task history."