task,user_action_and_explanation,observation
Find hotels for 2 adults in London with a price less than 250 dollars for four days starting from January 25. You must browse the page and offer at least 3 options. Current date is: 2025-01-05.,Going to https://www.booking.com/,Went to https://www.booking.com/
Find hotels for 2 adults in London with a price less than 250 dollars for four days starting from January 25. You must browse the page and offer at least 3 options. Current date is: 2025-01-05.,type 'London' into the search field with the placeholder 'Where are you going?' to specify the destination for the hotel search.,"The user has successfully entered 'London' into the search field for the destination. The date picker is open, ready to select check-in and check-out dates for January 2025."
Find hotels for 2 adults in London with a price less than 250 dollars for four days starting from January 25. You must browse the page and offer at least 3 options. Current date is: 2025-01-05.,"Changing URL parameters. The current URL is Booking.com, which is a travel website specializing in booking accommodations. The task is to find hotels in London for 2 adults staying from January 25 to January 29, 2025, with a maximum price of 250 dollars per night.

To complete this task, we construct a search URL that specifies the location (London), the check-in and check-out dates, and the number of adults. Additionally, we add a filter for the price to not exceed 250 dollars. The query parameters in the URL are set up to reflect these criteria. By navigating to this URL, users will be shown hotel options that match their search criteria, enabling them to browse and select suitable accommodations.",Went to https://www.booking.com/searchresults.en-gb.html?ss=London&checkin_year=2025&checkin_month=1&checkin_monthday=25&checkout_year=2025&checkout_month=1&checkout_monthday=29&group_adults=2&no_rooms=1&sb_price_type=total&price_to=250
Find hotels for 2 adults in London with a price less than 250 dollars for four days starting from January 25. You must browse the page and offer at least 3 options. Current date is: 2025-01-05.,"click the 'Search' button labeled 'Search' to submit the search query for hotels in London, ensuring that the desired criteria are applied and results are displayed.","The search query did not execute successfully as the 'Where are you going?' field is empty. Consequently, no hotel results have been generated. The user needs to re-enter 'London' into the destination field to proceed with their hotel search."
Find hotels for 2 adults in London with a price less than 250 dollars for four days starting from January 25. You must browse the page and offer at least 3 options. Current date is: 2025-01-05.,type 'London' in the destination input field with the placeholder 'Where are you going?' to set the search criteria for the hotel location to London.,"The user has successfully entered 'Central London, London, Greater London, United Kingdom' into the destination field. The calendar for selecting check-in and check-out dates is open, allowing the user to choose dates for the stay. The current task requires selecting the check-in date as January 25, 2025, and a checkout date four nights later, which would be January 29, 2025."
Find hotels for 2 adults in London with a price less than 250 dollars for four days starting from January 25. You must browse the page and offer at least 3 options. Current date is: 2025-01-05.,"click on '25' in the January 2025 calendar to select it as the check-in date, ensuring accurate date selection for the stay.","The user has successfully clicked on January 25th as the check-in date in the calendar. The calendar is currently open, but the check-out date, required for a four-night stay, has not been selected yet. The task is not fully complete as the checkout date needs to be set to January 29th, 2025, to proceed with the search."
Find hotels for 2 adults in London with a price less than 250 dollars for four days starting from January 25. You must browse the page and offer at least 3 options. Current date is: 2025-01-05.,"click on '29' in the January 2025 calendar to set it as the check-out date, completing the date selection necessary for the four-night stay.","The user has successfully selected both the check-in date as January 25, 2025, and the check-out date as January 29, 2025. The destination is set to Central London, with 2 adults and 1 room specified. The 'Search' button is ready to be clicked to execute the query based on these criteria. The price filter of under 250 dollars hasn't visibly been set yet, so it may need further adjustment after the initial search is performed."
Find hotels for 2 adults in London with a price less than 250 dollars for four days starting from January 25. You must browse the page and offer at least 3 options. Current date is: 2025-01-05.,"click the 'Search' button to submit the query and generate results for hotels in London from January 25 to January 29, 2025, for 2 adults at prices not exceeding 250 dollars per night.","The search results have been generated, but the price filter is including results above the desired budget. Adjust the price filter to under $250 per night. Currently, options such as Park Plaza Victoria and citizenM Tower of London are above this budget."
Find hotels for 2 adults in London with a price less than 250 dollars for four days starting from January 25. You must browse the page and offer at least 3 options. Current date is: 2025-01-05.,"Changing URL parameters. To fulfill the user's requirement of finding hotels in London for 2 adults with a price of less than 250 dollars for four days starting from January 25, I have adjusted the URL parameters: 'checkin=2025-01-25' to 'checkout=2025-01-29', ensuring a four-night stay, and added 'price_filter=USD-0-250' to filter hotels under 250 dollars. The 'rows=3' parameter is used to limit the result to 3 options, matching the user's request for at least three suggestions.",Went to https://www.booking.com/searchresults.html?ss=London%2C+Greater+London%2C+United+Kingdom&checkin=2025-01-25&checkout=2025-01-29&group_adults=2&no_rooms=1&group_children=0&price_filter=USD-0-250&dest_id=2280&dest_type=district&rows=3
Find hotels for 2 adults in London with a price less than 250 dollars for four days starting from January 25. You must browse the page and offer at least 3 options. Current date is: 2025-01-05.,click the 'See availability' button for 'Park International Hotel' to explore detailed information about this specific hotel and check if it meets the budget requirement.,"You are viewing the details for 'Park International Hotel,' located at 117-129 Cromwell Road, Kensington and Chelsea, London. The page shows images of the hotel, some of its amenities, and highlights that it may offer a Genius discount, which could make it fit your budget constraint. However, there is no specific price information visible on this page, so the user needs to check the 'Info & prices' section for exact rates to ensure they are within the $250 budget per night."
Find hotels for 2 adults in London with a price less than 250 dollars for four days starting from January 25. You must browse the page and offer at least 3 options. Current date is: 2025-01-05.,"type '29' in the calendar interface to select January 29th, 2025 as the check-out date, ensuring the correct duration of four nights is applied to the search.","The current search results show the Park International Hotel in London with details about amenities and location. However, there are no visible options about the cost per night or whether it matches the criteria of being under 250 dollars per night. More options need to be browsed to find at least three hotels within the specified budget."
Find hotels for 2 adults in London with a price less than 250 dollars for four days starting from January 25. You must browse the page and offer at least 3 options. Current date is: 2025-01-05.,"click the 'X' button next to 'Oasis Inn and Suites Joshua Tree - 29 Palms' to clear the incorrect destination and ensure 'Central London, London, Greater London, United Kingdom' is correctly set for the search.","The action to clear the incorrect destination was not executed successfully. The screenshot shows that the search destination field is still empty, meaning the user needs to re-enter 'Central London, London, Greater London, United Kingdom'. The page is displaying a hotel, ""Park International Hotel,"" located in London, but it appears to be based on an incorrect or previous search result. The search form is not populated with any current search criteria, so the task of finding hotels in London within the budget constraints remains incomplete."
Find hotels for 2 adults in London with a price less than 250 dollars for four days starting from January 25. You must browse the page and offer at least 3 options. Current date is: 2025-01-05.,"click on '29' in the January 2025 calendar to select it as the check-out date, completing the required stay duration.","The search results show hotel options for the specified dates (January 25-29) for 2 adults in Central London. However, none of the available options are under the budget of 250 dollars per night, but I will provide some closest to the target per-night rate:

1. **Double Room at Park International Hotel**: 
   - Price for 4 nights: $405 (total)
   - Rate per night: Around $101.25
   - Note: This meets the budget criteria for a total stay.

2. **Option 2** (higher price but listed for comparison):
   - For $541 (total)
   - Rate per night: Approx. $135.25
   - Free cancellation offered.

3. **Option 3** (higher price):
   - For $623 (total)
   - Rate per night: Approx. $155.75
   - Includes breakfast and free cancellation.

You need to filter results further or adjust criteria for under $250 per night per room if intended differently."
Find hotels for 2 adults in London with a price less than 250 dollars for four days starting from January 25. You must browse the page and offer at least 3 options. Current date is: 2025-01-05.,"scroll down to view more hotel options and prices, ensuring that at least three options are available under 250 dollars per night for comparison.","The current page displays several hotel options in London for the specified dates. However, based on the provided screenshot, there are no hotels priced under $250 per night for four nights (total <$1000), including VAT. The cheapest option shown is $405 for four nights before VAT, which exceeds the required budget when VAT is included (amounting typically to 20%). This means no options under the price constraint are visible here due to VAT added to the shown prices. Additional price adjustments or different listings would be needed to meet the budget criteria."
Find hotels for 2 adults in London with a price less than 250 dollars for four days starting from January 25. You must browse the page and offer at least 3 options. Current date is: 2025-01-05.,"scroll down the listing to view more hotel options and ensure that all potential accommodations are visible, allowing for the selection of at least three options priced below 250 dollars.","The listing shows several hotel room options for two adults in Central London. Here are three options that are priced below $250 per night (or equivalent for 4 nights):

1. Junior Suite - Total price for 4 nights: $637. 
2. Single Room - Total price for 4 nights: $343. 

The remaining options exceed the $250 per night threshold.

The task for finding three options is incomplete; only two options match the criteria required for the task, suggesting further search or adjustment might be necessary."
Find hotels for 2 adults in London with a price less than 250 dollars for four days starting from January 25. You must browse the page and offer at least 3 options. Current date is: 2025-01-05.,"scroll down to see more options that fit the budget, allowing the identification of at least 3 options that are within the specified price range of less than 250 dollars per night.","There is an option displayed, but the total price for 4 nights is $508, which exceeds the budget of $250 per night. There is no visibility of other options that fit the criteria of less than $250 per night in the current screenshot. Additional filtering or searching may be needed to find options that fit the budget. Due to the limited supply note, availability might be causing fewer budget-friendly results."
Find hotels for 2 adults in London with a price less than 250 dollars for four days starting from January 25. You must browse the page and offer at least 3 options. Current date is: 2025-01-05.,"click on '29' in the January 2025 calendar to select it as the check-out date, completing the date range for the stay and allowing for the search to proceed.","The current screenshot does not reflect the hotel search results page. Instead, it shows a section with guest reviews, commonly asked questions by travelers, and information about the hotel's area, such as nearby attractions and public transport. It seems the action to click the 'Search' button hasn't been performed or executed successfully, as the screen isn't displaying the hotel options matching the specified criteria (location, dates, and price). The user needs to ensure they execute the search action to see the appropriate hotel listings."
Find hotels for 2 adults in London with a price less than 250 dollars for four days starting from January 25. You must browse the page and offer at least 3 options. Current date is: 2025-01-05.,"click on '29' in the January 2025 calendar to select it as the check-out date, ensuring the search criteria include a four-night stay.","The search has returned a hotel option, but the price displayed is $508 for four nights, which exceeds the budget of $250 per night. Only one hotel is visible, and it appears that many similar options are already unavailable for the selected dates. The price filter might need to be adjusted or refined to find more within-budget options."
Find hotels for 2 adults in London with a price less than 250 dollars for four days starting from January 25. You must browse the page and offer at least 3 options. Current date is: 2025-01-05.,scroll down to view additional hotel options and ensure the page displays at least three options as required by the task.,The screenshot does not display any list of hotels matching the search criteria; it only shows reviews from previous guests and some locational information about nearby attractions and facilities. This suggests that scrolling further might be necessary to view the actual hotel options or that the filtering criteria are not correctly applied if no listed accommodations appear that meet them.
Find hotels for 2 adults in London with a price less than 250 dollars for four days starting from January 25. You must browse the page and offer at least 3 options. Current date is: 2025-01-05.,"Changing URL parameters. The current URL is focused on a specific hotel in London. To fulfill the task of finding at least three hotel options for 2 adults with a price limit of 250 dollars, I reconstructed a new search URL on Booking.com that lists hotels in London for the specified dates, number of adults, and price range. This will provide a broader selection of hotels, meeting the task's requirements.",Went to https://www.booking.com/searchresults.html?aid=304142&label=gen173nr-1FCAQoggJCDWRpc3RyaWN0XzIyODBIM1gEaIkCiAEBmAEJuAEYyAEM2AEB6AEB-AEDiAIBqAIEuAKTpOm7BsACAdICJGI1ZTc0MTA2LWE0MDEtNDM5NC04YzMzLTJlZGVhZTJlN2E1MtgCBeACAQ&sid=32d7dd4975171557171102685bbdf533&dest_id=-2601889&dest_type=city&checkin_year=2025&checkin_month=1&checkin_monthday=25&checkout_year=2025&checkout_month=1&checkout_monthday=29&group_adults=2&group_children=0&no_rooms=1&sb_price_type=total&order=price&price_filter_currencychange=1&price=USD-0-250
Find hotels for 2 adults in London with a price less than 250 dollars for four days starting from January 25. You must browse the page and offer at least 3 options. Current date is: 2025-01-05.,"click on the 'Show prices' button for any of the hotel options, such as 'Golders way rooms', to see the detailed pricing information and confirm it meets the budget criteria.","Currently viewing the details for 'Golders way rooms.' The page displays photos and a brief description, but does not show specific pricing information. To determine if it meets the budget requirements (under 250 dollars per night), detailed prices need to be visible. Consider scrolling down or checking another tab labeled 'Info & prices' for specific rates."
Find hotels for 2 adults in London with a price less than 250 dollars for four days starting from January 25. You must browse the page and offer at least 3 options. Current date is: 2025-01-05.,"Changing URL parameters. Based on the task goal of finding hotels in London for 2 adults from January 25, 2025, for four days with a maximum price of $250, constructing a new search URL on Booking.com meets the criteria. The URL is crafted to search for hotels in London with specified check-in and check-out dates, for 2 adults, ordered by price, and filtered for prices up to $250.",Went to https://www.booking.com/searchresults.en-gb.html?ss=London&checkin_monthday=25&checkin_month=1&checkin_year=2025&checkout_monthday=29&checkout_month=1&checkout_year=2025&group_adults=2&group_children=0&no_rooms=1&sb_travel_purpose=leisure&order=price&price=0-250
Find hotels for 2 adults in London with a price less than 250 dollars for four days starting from January 25. You must browse the page and offer at least 3 options. Current date is: 2025-01-05.,"click the 'Search' button with the text 'Search' to retrieve hotel results in London for the specified dates and criteria, ensuring the search query is executed.","The search results page displays available accommodations for the specified criteria in London. Filters show **7,626 properties**. However, the results are not yet filtered by price under 250 dollars. The user should apply the price filter for accurate results within the budget. Currently, some hotels are visible, but to assure they meet the price limit, applying the budget filter is necessary."
Find hotels for 2 adults in London with a price less than 250 dollars for four days starting from January 25. You must browse the page and offer at least 3 options. Current date is: 2025-01-05.,"Changing URL parameters. The suggested URL performs a search on Booking.com for hotels in London, corresponding to the specified dates (January 25-29, 2025) for 2 adults. The query is filtered to show hotels with a total price of less than 250 dollars. By using the 'order=price' parameter, the results are sorted by price, helping to find options fitting the budget constraint. This matches the user's requirements, including filtering results to ensure relevance.",Went to https://www.booking.com/searchresults.html?ss=London&label=gen173nr-1FCAQoggJCDXNlYXJjaF9sb25kb25ICVgEaIkCiAEBmAEJuAEYyAEM2AEB6AEB-AEDiAIBqAIEuAKLqem7BsACAdICJDQ5ZDRhMzU3LTBmNGYtNDVhNS1hMTUzLTljZDIzMzI3ODNlZdgCBeACAQ&sid=32d7dd4975171557171102685bbdf533&aid=304142&lang=en-us&src_elem=sb&src=index&dest_id=-2601889&dest_type=city&checkin=2025-01-25&checkout=2025-01-29&group_adults=2&no_rooms=1&group_children=0&sb_price_type=total&order=price&nflt=price%3C250
Find hotels for 2 adults in London with a price less than 250 dollars for four days starting from January 25. You must browse the page and offer at least 3 options. Current date is: 2025-01-05.,scroll down the list of hotel options to view more accommodations and find at least three suitable options that meet the price criteria.,"The search results show several options for accommodations in London. Here are three potential options based on the visible screenshot: 1. Willesden Green Budget Guesthouse located 5.3 miles from downtown and offering a triple room with 3 bunk beds. 2. Safestay London Kensington Holland Park located 3.2 miles from downtown and offering beds in a mixed dormitory with shared bathroom facilities. 3. 24/7 London Hostel, located 4.4 miles from downtown, offering beds in a 10-bed mixed dormitory room. These options fit within the user's specified criteria of accommodations in London, but it's unclear if the price criteria of under 250 dollars per night is met as the prices are not visible in the current screenshot."
Find hotels for 2 adults in London with a price less than 250 dollars for four days starting from January 25. You must browse the page and offer at least 3 options. Current date is: 2025-01-05.,"click on '29' in the January 2025 calendar to select it as the checkout date, ensuring the stay duration is set correctly for four nights starting from the check-in date.","The hotels listed are showing various options in London within the selected dates. However, the prices shown are not visible in this screenshot to confirm if they are under the 250-dollar limit per night. Additionally, considering some getaways like 'Popular neighborhoods' have high starting prices, it suggests the need to refine the search with precise price filters. Further navigation or filtering may be essential to list three options under the specified budget limit."
Find hotels for 2 adults in London with a price less than 250 dollars for four days starting from January 25. You must browse the page and offer at least 3 options. Current date is: 2025-01-05.,"Changing URL parameters. The original URL is almost complete for the search criteria specified in the task. However, to ensure the correct checkout date and stay duration, the URL needs to be updated to reflect the checkout date as January 29th, 2025. This adjustment ensures that the stay is for four nights starting January 25th, 2025. The filters are already set for 2 adults and a room price under 250 dollars, so no further changes are needed in those parameters.",Went to https://www.booking.com/searchresults.html?ss=London&checkin=2025-01-25&checkout=2025-01-29&group_adults=2&no_rooms=1&group_children=0&order=price&nflt=price%3C250&label=gen173nr-1FCAQoggJCDXNlYXJjaF9sb25kb25ICVgEaIkCiAEBmAEJuAEYyAEM2AEB6AEB-AEDiAIBqAIEuAKLqem7BsACAdICJDQ5ZDRhMzU3LTBmNGYtNDVhNS1hMTUzLTljZDIzMzI3ODNlZdgCBeACAQ&sid=32d7dd4975171557171102685bbdf533&aid=304142&lang=en-us&src_elem=sb
Find hotels for 2 adults in London with a price less than 250 dollars for four days starting from January 25. You must browse the page and offer at least 3 options. Current date is: 2025-01-05.,"click on 'Search' button to execute the search query with the specified criteria, including destination, dates, and guest details, to find hotels in London.","The search results page displays 7,625 properties available for the specified dates in London. However, the filter for price under $250 per night does not appear to be applied directly. The budget slider ranges from $20 to $500+, but it will need manual adjustment to ensure results match the price requirement. Without the price filter applied, it's unclear if the shown options meet the budget criteria. The first few visible options are 'Park International Hotel', 'Deluxe studio Apartments', and 'Modern 1 bed | City views | Work Space', though prices should be verified manually to ensure they are under $250 per night."
Find hotels for 2 adults in London with a price less than 250 dollars for four days starting from January 25. You must browse the page and offer at least 3 options. Current date is: 2025-01-05.,"Changing URL parameters. The task requires filtering hotel search results in London for two adults, focusing on options costing less than $250 per night for a four-day stay starting January 25, 2025. The current URL already specifies a search in London with a check-in date of January 25 and check-out on January 29 for 2 adults. By adding the 'price' parameter as '1-250', we adjust the results to include only hotels with prices up to 250 dollars per night, which directly addresses the task requirement to find suitable lodging options within the specified budget.",Went to https://www.booking.com/searchresults.html?ss=London&checkin=2025-01-25&checkout=2025-01-29&group_adults=2&no_rooms=1&group_children=0&price=1-250
Find hotels for 2 adults in London with a price less than 250 dollars for four days starting from January 25. You must browse the page and offer at least 3 options. Current date is: 2025-01-05.,"click 'Search' button labeled 'Search' to execute the hotel search with the criteria set for London, ensuring the search for accommodations from January 25 to 29, 2025, for two adults is performed.","The search has successfully executed, generating 7,624 property options in London from January 25 to January 29, 2025, for 2 adults in 1 room. The results are currently sorted by 'Our top picks'. The filter option for price doesn't appear to be set for a maximum of $250 per night yet, which might need further adjustment. However, there are several properties showing initial pricing. Examples include Park International Hotel, Deluxe Studio Apartments, and Modern 1 bed City views I Work Space, but the exact nightly prices may need closer inspection to confirm if they fit within the price criteria."